{
  "$schema": "https://json-schema.org/draft/2020-12/schema",
  "$id": "https://neoos.local/schemas/report-v1.json",
  "title": "NeoOS Daily Report",
  "type": "object",
  "required": ["schemaVersion", "asOf", "mode", "deployment", "scores", "radar", "assets"],
  "properties": {
    "schemaVersion": { "const": "1.0" },
    "asOf": { "type": "string", "format": "date-time" },
    "mode": { "enum": ["demo", "live"] },
    "deployment": {
      "type": "object",
      "required": ["score", "recommendation", "posture", "reasons"],
      "properties": {
        "score": { "type": "number", "minimum": 0, "maximum": 100 },
        "recommendation": { "type": "string" },
        "posture": { "type": "string" },
        "reasons": { "type": "array", "items": { "type": "string" }, "minItems": 1 }
      }
    },
    "scores": {
      "type": "object",
      "required": ["cash", "market", "opportunity", "confidence", "evidenceIntegrity", "reserveHealth"],
      "additionalProperties": { "type": "number", "minimum": 0, "maximum": 100 }
    },
    "radar": {
      "type": "array",
      "items": {
        "type": "object",
        "required": ["id", "severity", "title", "detail"],
        "properties": {
          "id": { "type": "string" },
          "severity": { "enum": ["info", "positive", "caution", "risk"] },
          "title": { "type": "string" },
          "detail": { "type": "string" }
        }
      }
    },
    "assets": {
      "type": "array",
      "items": {
        "type": "object",
        "required": ["id", "name", "score", "rating", "confidence"],
        "properties": {
          "id": { "type": "string" },
          "ticker": { "type": "string" },
          "name": { "type": "string" },
          "score": { "type": "number", "minimum": 0, "maximum": 100 },
          "rating": { "enum": ["Strong Buy", "Buy", "Accumulate", "Hold", "Reduce", "Sell", "Avoid"] },
          "confidence": { "type": "number", "minimum": 0, "maximum": 100 },
          "intrinsicValueLow": { "type": ["number", "null"] },
          "intrinsicValueHigh": { "type": ["number", "null"] },
          "buyBelow": { "type": ["number", "null"] },
          "strongBuyBelow": { "type": ["number", "null"] }
        }
      }
    }
  }
}
